{
  "schemaVersion": 1,
  "name": "rnm-dev/armory",
  "updatedAt": "2026-10-05T11:30:22.540Z",
  "packages": [
    {
      "id": "heroboard",
      "displayName": "Heroboard",
      "iconUrl": "https://raw.githubusercontent.com/rnm-dev/armory/main/packages/heroboard/assets/icon.png",
      "summary": "Track projects, tasks, progress, and XP from your coding agent.",
      "publisher": "rnm-dev",
      "documentationUrl": "https://github.com/rnm-dev/armory/tree/main/packages/heroboard",
      "requirements": {
        "credentials": true,
        "hostWrites": false
      },
      "latest": "1.0.1",
      "versions": [
        {
          "version": "1.0.0",
          "minPeonVersion": "0.0.1",
          "platforms": [
            {
              "os": "darwin",
              "arch": "arm64"
            },
            {
              "os": "darwin",
              "arch": "x64"
            },
            {
              "os": "linux",
              "arch": "arm64"
            },
            {
              "os": "linux",
              "arch": "x64"
            }
          ],
          "archive": {
            "url": "https://github.com/rnm-dev/armory/releases/download/heroboard-v1.0.0/heroboard-1.0.0.tar.gz",
            "size": 124970,
            "sha256": "92db931440581a4370092dbc8c225962df93f25b9128734b4e0b606da106a3fd"
          }
        },
        {
          "version": "1.0.1",
          "minPeonVersion": "0.0.1",
          "platforms": [
            {
              "os": "darwin",
              "arch": "arm64"
            },
            {
              "os": "darwin",
              "arch": "x64"
            },
            {
              "os": "linux",
              "arch": "arm64"
            },
            {
              "os": "linux",
              "arch": "x64"
            }
          ],
          "archive": {
            "url": "https://github.com/rnm-dev/armory/releases/download/heroboard-v1.0.1/heroboard-1.0.1.tar.gz",
            "size": 437648,
            "sha256": "37d19abd6403674f79431359a4d4f8317eb8ccbb3f85df458a8db146ca400ff7"
          }
        }
      ]
    },
    {
      "id": "cloudflare",
      "displayName": "Cloudflare",
      "iconUrl": "https://raw.githubusercontent.com/rnm-dev/armory/main/packages/cloudflare/assets/icon.png",
      "summary": "Manage Cloudflare DNS, tunnels, Turnstile, Pages, and Workers deployments and secrets.",
      "publisher": "rnm-dev",
      "documentationUrl": "https://github.com/rnm-dev/armory/tree/main/packages/cloudflare",
      "requirements": {
        "credentials": true,
        "hostWrites": false
      },
      "latest": "0.6.0",
      "versions": [
        {
          "version": "0.1.0",
          "minPeonVersion": "0.0.1",
          "platforms": [
            {
              "os": "darwin",
              "arch": "arm64"
            },
            {
              "os": "darwin",
              "arch": "x64"
            },
            {
              "os": "linux",
              "arch": "arm64"
            },
            {
              "os": "linux",
              "arch": "x64"
            }
          ],
          "archive": {
            "url": "https://github.com/rnm-dev/armory/releases/download/cloudflare-v0.1.0/cloudflare-0.1.0.tar.gz",
            "size": 192075,
            "sha256": "8ff376a053ca834de43426c939844587f469ed10446e9eef59f70febfc6788a8"
          }
        },
        {
          "version": "0.1.1",
          "minPeonVersion": "0.0.1",
          "platforms": [
            {
              "os": "darwin",
              "arch": "arm64"
            },
            {
              "os": "darwin",
              "arch": "x64"
            },
            {
              "os": "linux",
              "arch": "arm64"
            },
            {
              "os": "linux",
              "arch": "x64"
            }
          ],
          "archive": {
            "url": "https://github.com/rnm-dev/armory/releases/download/cloudflare-v0.1.1/cloudflare-0.1.1.tar.gz",
            "size": 431935,
            "sha256": "89a5d8e413071902aa3aec6676c42561c9e8fbd25d36a0438b0c7bf0ae767b84"
          }
        },
        {
          "version": "0.2.0",
          "minPeonVersion": "0.0.1",
          "platforms": [
            {
              "os": "darwin",
              "arch": "arm64"
            },
            {
              "os": "darwin",
              "arch": "x64"
            },
            {
              "os": "linux",
              "arch": "arm64"
            },
            {
              "os": "linux",
              "arch": "x64"
            }
          ],
          "archive": {
            "url": "https://github.com/rnm-dev/armory/releases/download/cloudflare-v0.2.0/cloudflare-0.2.0.tar.gz",
            "size": 432941,
            "sha256": "a3a78aa230f021fa28a9d6b2014ff75f82d60a0e56be4fbbcad94efde2d75d2a"
          }
        },
        {
          "version": "0.3.0",
          "minPeonVersion": "0.0.1",
          "platforms": [
            {
              "os": "darwin",
              "arch": "arm64"
            },
            {
              "os": "darwin",
              "arch": "x64"
            },
            {
              "os": "linux",
              "arch": "arm64"
            },
            {
              "os": "linux",
              "arch": "x64"
            }
          ],
          "archive": {
            "url": "https://github.com/rnm-dev/armory/releases/download/cloudflare-v0.3.0/cloudflare-0.3.0.tar.gz",
            "size": 433717,
            "sha256": "baa3734ce31f7640ed5f345650f91070e0357e4374eb9a9d61f3f5358822d7f7"
          }
        },
        {
          "version": "0.4.0",
          "minPeonVersion": "0.0.1",
          "platforms": [
            {
              "os": "darwin",
              "arch": "arm64"
            },
            {
              "os": "darwin",
              "arch": "x64"
            },
            {
              "os": "linux",
              "arch": "arm64"
            },
            {
              "os": "linux",
              "arch": "x64"
            }
          ],
          "archive": {
            "url": "https://github.com/rnm-dev/armory/releases/download/cloudflare-v0.4.0/cloudflare-0.4.0.tar.gz",
            "size": 531468,
            "sha256": "e80bfcb8a4f007405e95a9b96a064a85cd635ce7fd52a9ff18484676fa5905ba"
          }
        },
        {
          "version": "0.5.0",
          "minPeonVersion": "0.0.1",
          "platforms": [
            {
              "os": "darwin",
              "arch": "arm64"
            },
            {
              "os": "darwin",
              "arch": "x64"
            },
            {
              "os": "linux",
              "arch": "arm64"
            },
            {
              "os": "linux",
              "arch": "x64"
            }
          ],
          "archive": {
            "url": "https://github.com/rnm-dev/armory/releases/download/cloudflare-v0.5.0/cloudflare-0.5.0.tar.gz",
            "size": 532072,
            "sha256": "4e1db1372114db57572a946a8cf8768b10997b726ff3d9ef84f1abbc371cf8de"
          }
        },
        {
          "version": "0.5.1",
          "minPeonVersion": "0.0.1",
          "platforms": [
            {
              "os": "darwin",
              "arch": "arm64"
            },
            {
              "os": "darwin",
              "arch": "x64"
            },
            {
              "os": "linux",
              "arch": "arm64"
            },
            {
              "os": "linux",
              "arch": "x64"
            }
          ],
          "archive": {
            "url": "https://github.com/rnm-dev/armory/releases/download/cloudflare-v0.5.1/cloudflare-0.5.1.tar.gz",
            "size": 532267,
            "sha256": "4f351ad398908fa5e2288d27d91eb4171ad0deed6c50298c928df56fe7872d6e"
          }
        },
        {
          "version": "0.5.2",
          "minPeonVersion": "0.0.1",
          "platforms": [
            {
              "os": "darwin",
              "arch": "arm64"
            },
            {
              "os": "darwin",
              "arch": "x64"
            },
            {
              "os": "linux",
              "arch": "arm64"
            },
            {
              "os": "linux",
              "arch": "x64"
            }
          ],
          "archive": {
            "url": "https://github.com/rnm-dev/armory/releases/download/cloudflare-v0.5.2/cloudflare-0.5.2.tar.gz",
            "size": 533567,
            "sha256": "0523b323d8af9d60f144925399045b075ab56712796946b0440a462db18d7c79"
          }
        },
        {
          "version": "0.5.3",
          "minPeonVersion": "0.0.1",
          "platforms": [
            {
              "os": "darwin",
              "arch": "arm64"
            },
            {
              "os": "darwin",
              "arch": "x64"
            },
            {
              "os": "linux",
              "arch": "arm64"
            },
            {
              "os": "linux",
              "arch": "x64"
            }
          ],
          "archive": {
            "url": "https://github.com/rnm-dev/armory/releases/download/cloudflare-v0.5.3/cloudflare-0.5.3.tar.gz",
            "size": 533955,
            "sha256": "abe519e01cd3954bb45c887443731c6eda1d6be08240a79ddea8a0732edafbc4"
          }
        },
        {
          "version": "0.6.0",
          "minPeonVersion": "0.0.1",
          "platforms": [
            {
              "os": "darwin",
              "arch": "arm64"
            },
            {
              "os": "darwin",
              "arch": "x64"
            },
            {
              "os": "linux",
              "arch": "arm64"
            },
            {
              "os": "linux",
              "arch": "x64"
            }
          ],
          "archive": {
            "url": "https://github.com/rnm-dev/armory/releases/download/cloudflare-v0.6.0/cloudflare-0.6.0.tar.gz",
            "size": 534622,